{
  "metadata": {
    "module_id": "bots.archive",
    "sequence_id": "archive_golden_v1",
    "length": 4
  },

  "timeline": [
    {
      "index": 1,
      "timestamp": "2026-08-01T10:00:00",
      "content_hash": "hash_v1_0",
      "metadata": { "version": "1.0" }
    },
    {
      "index": 2,
      "timestamp": "2026-08-01T12:00:00",
      "content_hash": "hash_v1_1",
      "metadata": { "version": "1.1" }
    },
    {
      "index": 3,
      "timestamp": "2026-08-01T14:00:00",
      "content_hash": "hash_v2_0",
      "metadata": { "version": "2.0" }
    },
    {
      "index": 4,
      "timestamp": "2026-08-01T16:00:00",
      "content_hash": "hash_v2_1",
      "metadata": { "version": "2.1" }
    }
  ],

  "lumen": [
    { "index": 1, "signals": ["outline_structure"] },
    { "index": 2, "signals": ["drift_taxonomy_added"] },
    { "index": 3, "signals": ["major_rewrite", "collapse_signature"] },
    { "index": 4, "signals": ["restoration", "triadic_unification"] }
  ],

  "regime": [
    { "index": 1, "regime": "local" },
    { "index": 2, "regime": "structural" },
    { "index": 3, "regime": "continuity" },
    { "index": 4, "regime": "continuity" }
  ],

  "ancestry": [
    {
      "index": 1,
      "collapse_signature": false,
      "projection_loss": false
    },
    {
      "index": 2,
      "collapse_signature": false,
      "projection_loss": false
    },
    {
      "index": 3,
      "collapse_signature": true,
      "projection_loss": false
    },
    {
      "index": 4,
      "collapse_signature": false,
      "projection_loss": true
    }
  ],

  "drift": {
    "direction": "toward-unified-triadic-arc",
    "strength": "medium"
  },

  "triadic_identity": {
    "local": 0.24,
    "structural": 0.38,
    "continuity": 0.38,
    "risk": 0.33,
    "final": 0.72
  }
}
